episode_number,guest,title,title_topics,chapter_topics,all_topics
452,Dario Amodei,"Anthropic CEO on Claude, AGI & the Future of AI & Humanity",Anthropic CEO on Claude; AGI; the Future of AI; Humanity,"Scaling laws; Limits of LLM scaling; Competition with OpenAI, Google, xAI, Meta; Claude; Opus 3.5; Sonnet 3.5; Claude 4.0; Criticism of Claude; AI Safety Levels; ASL-3 and ASL-4; Computer use; Government regulation of AI; Hiring a great team; Post-training; Constitutional AI; Machines of Loving Grace; AGI timeline; Programming; Meaning of life; Amanda Askell; Programming advice for non-technical people; Talking to Claude; Prompt engineering; Post-training; Constitutional AI; System prompts; Is Claude getting dumber?; Character training; Nature of truth; Optimal rate of failure; AI consciousness; AGI; Chris Olah; Features, Circuits, Universality; Superposition; Monosemanticity; Scaling Monosemanticity; Macroscopic behavior of neural networks; Beauty of neural networks","Anthropic CEO on Claude; AGI; the Future of AI; Humanity; Scaling laws; Limits of LLM scaling; Competition with OpenAI, Google, xAI, Meta; Claude; Opus 3.5; Sonnet 3.5; Claude 4.0; Criticism of Claude; AI Safety Levels; ASL-3 and ASL-4; Computer use; Government regulation of AI; Hiring a great team; Post-training; Constitutional AI; Machines of Loving Grace; AGI timeline; Programming; Meaning of life; Amanda Askell; Programming advice for non-technical people; Talking to Claude; Prompt engineering; Post-training; Constitutional AI; System prompts; Is Claude getting dumber?; Character training; Nature of truth; Optimal rate of failure; AI consciousness; AGI; Chris Olah; Features, Circuits, Universality; Superposition; Monosemanticity; Scaling Monosemanticity; Macroscopic behavior of neural networks; Beauty of neural networks"
453,Javier Milei,"President of Argentina - Freedom, Economics, and Corruption",President of Argentina - Freedom; Economics; and Corruption,Economic freedom; Anarcho-capitalism; Presidency and reforms; Poverty; Corruption; Freedom; Elon Musk; DOGE; Donald Trump; US and Argentina relations; Messi vs Maradona; God; Elvis and Rolling Stones; Free market; Loyalty; Advice for young people; Hope for Argentina,President of Argentina - Freedom; Economics; and Corruption; Economic freedom; Anarcho-capitalism; Presidency and reforms; Poverty; Corruption; Freedom; Elon Musk; DOGE; Donald Trump; US and Argentina relations; Messi vs Maradona; God; Elvis and Rolling Stones; Free market; Loyalty; Advice for young people; Hope for Argentina
454,Saagar Enjeti,"Trump, MAGA, DOGE, Obama, FDR, JFK, History & Politics",Trump; MAGA; DOGE; Obama; FDR; JFK; History; Politics,Why Trump won; Book recommendations; History of wokeism; History of Scots-Irish; Biden; FDR; George W Bush; LBJ; Cuban Missile Crisis; Immigration; DOGE; MAGA ideology; Bernie Sanders; Obama vs Trump; Nancy Pelosi; Kamala Harris; 2020 Election; Sam Harris; UFOs; Future of the Republican Party; Future of the Democratic Party; Hope,Trump; MAGA; DOGE; Obama; FDR; JFK; History; Politics; Why Trump won; Book recommendations; History of wokeism; History of Scots-Irish; Biden; FDR; George W Bush; LBJ; Cuban Missile Crisis; Immigration; DOGE; MAGA ideology; Bernie Sanders; Obama vs Trump; Nancy Pelosi; Kamala Harris; 2020 Election; Sam Harris; UFOs; Future of the Republican Party; Future of the Democratic Party; Hope
455,Adam Frank,Alien Civilizations and the Search for Extraterrestrial Life,Alien Civilizations; the Search for Extraterrestrial Life,Planet formation; Plate tectonics; Extinction events; Biosphere; Technosphere; Emergence of intelligence; Drake equation; Exoplanets; Habitable zones; Fermi Paradox; Alien civilizations; Colonizing Mars; Search for aliens; Alien megastructures; Kardashev scale; Detecting aliens; Warp drives; Cryogenics; What aliens look like; Alien contact; UFO sightings; Physics of life; Nature of time; Cognition; Mortality,Alien Civilizations; the Search for Extraterrestrial Life; Planet formation; Plate tectonics; Extinction events; Biosphere; Technosphere; Emergence of intelligence; Drake equation; Exoplanets; Habitable zones; Fermi Paradox; Alien civilizations; Colonizing Mars; Search for aliens; Alien megastructures; Kardashev scale; Detecting aliens; Warp drives; Cryogenics; What aliens look like; Alien contact; UFO sightings; Physics of life; Nature of time; Cognition; Mortality
456,Volodymyr Zelenskyy,"Ukraine, War, Peace, Putin, Trump, NATO, and Freedom",Ukraine; War; Peace; Putin; Trump; NATO; and Freedom,"Introductory words from Lex; Language; World War II; Invasion on Feb 24, 2022; Negotiating Peace; NATO and security guarantees; Sitting down with Putin and Trump; Compromise and leverage; Putin and Russia; Donald Trump; Martial Law and Elections; Corruption; Elon Musk; Trump Inauguration on Jan 20; Power dynamics in Ukraine; Future of Ukraine; Choice of language; Podcast prep and research process; Travel and setup","Ukraine; War; Peace; Putin; Trump; NATO; and Freedom; Introductory words from Lex; Language; World War II; Invasion on Feb 24, 2022; Negotiating Peace; NATO and security guarantees; Sitting down with Putin and Trump; Compromise and leverage; Putin and Russia; Donald Trump; Martial Law and Elections; Corruption; Elon Musk; Trump Inauguration on Jan 20; Power dynamics in Ukraine; Future of Ukraine; Choice of language; Podcast prep and research process; Travel and setup"
457,Jennifer Burns,"Milton Friedman, Ayn Rand, Economics, Capitalism, Freedom",Milton Friedman; Ayn Rand; Economics; Capitalism; Freedom,Milton Friedman; The Great Depression; Schools of economic thought; Keynesian economics; Laissez-faire; Friedrich Hayek; Money and monetarism; Stagflation; Moral case for capitalism; Freedom; Ethics of competition; Win-win solutions; Corruption; Government intervention; Conservatism; Donald Trump; Inflation; DOGE; Javier Milei; Richard Nixon; Ronald Reagan; Cryptocurrency; Ayn Rand; The Fountainhead; Sex and power dynamics; Evolution of ideas in history; Postmodernism; Advice to students; Lex reflects on Volodymyr Zelenskyy interview,Milton Friedman; Ayn Rand; Economics; Capitalism; Freedom; Milton Friedman; The Great Depression; Schools of economic thought; Keynesian economics; Laissez-faire; Friedrich Hayek; Money and monetarism; Stagflation; Moral case for capitalism; Freedom; Ethics of competition; Win-win solutions; Corruption; Government intervention; Conservatism; Donald Trump; Inflation; DOGE; Javier Milei; Richard Nixon; Ronald Reagan; Cryptocurrency; Ayn Rand; The Fountainhead; Sex and power dynamics; Evolution of ideas in history; Postmodernism; Advice to students; Lex reflects on Volodymyr Zelenskyy interview
458,Marc Andreessen,"Trump, Power, Tech, AI, Immigration & Future of America",Trump; Power; Tech; AI; Immigration; Future of America,Best possible future; History of Western Civilization; Trump in 2025; TDS in tech; Preference falsification; Self-censorship; Censorship; Jon Stewart; Mark Zuckerberg on Joe Rogan; Government pressure; Nature of power; Journalism; Bill Ackman; Trump administration; DOGE; H1B and immigration; Little tech; AI race; X; Yann LeCun; Andrew Huberman; Success; God and humanity,Trump; Power; Tech; AI; Immigration; Future of America; Best possible future; History of Western Civilization; Trump in 2025; TDS in tech; Preference falsification; Self-censorship; Censorship; Jon Stewart; Mark Zuckerberg on Joe Rogan; Government pressure; Nature of power; Journalism; Bill Ackman; Trump administration; DOGE; H1B and immigration; Little tech; AI race; X; Yann LeCun; Andrew Huberman; Success; God and humanity
459,Deepseek Dylan Patel Nathan Lambert,"DeepSeek, China, OpenAI, NVIDIA, xAI, TSMC, Stargate, and AI Megaclusters",DeepSeek; China; OpenAI; NVIDIA; xAI; TSMC; Stargate; and AI Megaclusters,DeepSeek-R1 and DeepSeek-V3; Low cost of training; DeepSeek compute cluster; Export controls on GPUs to China; AGI timeline; China’s manufacturing capacity; Cold war with China; TSMC and Taiwan; Best GPUs for AI; Why DeepSeek is so cheap; Espionage; Censorship; Andrej Karpathy and magic of RL; OpenAI o3-mini vs DeepSeek r1; NVIDIA; GPU smuggling; DeepSeek training on OpenAI data; AI megaclusters; Who wins the race to AGI?; AI agents; Programming and AI; Open source; Stargate; Future of AI,DeepSeek; China; OpenAI; NVIDIA; xAI; TSMC; Stargate; and AI Megaclusters; DeepSeek-R1 and DeepSeek-V3; Low cost of training; DeepSeek compute cluster; Export controls on GPUs to China; AGI timeline; China’s manufacturing capacity; Cold war with China; TSMC and Taiwan; Best GPUs for AI; Why DeepSeek is so cheap; Espionage; Censorship; Andrej Karpathy and magic of RL; OpenAI o3-mini vs DeepSeek r1; NVIDIA; GPU smuggling; DeepSeek training on OpenAI data; AI megaclusters; Who wins the race to AGI?; AI agents; Programming and AI; Open source; Stargate; Future of AI
460,Narendra Modi,"Prime Minister of India - Power, Democracy, War & Peace",Prime Minister of India - Power; Democracy; War; Peace,In this episode…; Fasting; Early life; Advice to Young People; Journey in the Himalayas; Becoming a monk; RSS and Hindu nationalism; Explaining India; Mahatma Gandhi; Path to peace in Ukraine; India and Pakistan; Cricket and Football; Donald Trump; China and Xi Jinping; Gujarat riots in 2002; Biggest democracy in the world; Power; Hard work; Srinivasa Ramanujan; Decision-making process; AI; Education; Learning and focus; Mantra; Meditation; Lex visiting India; Siddhartha,Prime Minister of India - Power; Democracy; War; Peace; In this episode…; Fasting; Early life; Advice to Young People; Journey in the Himalayas; Becoming a monk; RSS and Hindu nationalism; Explaining India; Mahatma Gandhi; Path to peace in Ukraine; India and Pakistan; Cricket and Football; Donald Trump; China and Xi Jinping; Gujarat riots in 2002; Biggest democracy in the world; Power; Hard work; Srinivasa Ramanujan; Decision-making process; AI; Education; Learning and focus; Mantra; Meditation; Lex visiting India; Siddhartha
461,Theprimeagen,"Programming, AI, ADHD, Productivity, Addiction, and God",Programming; AI; ADHD; Productivity; Addiction; and God,"Love for programming; Hardest part of programming; Types of programming; Life story; Hardship; High school; Porn addiction; God; Perseverance; Netflix; Groovy; Printf() debugging; Falcor; Breaking production; Pieter Levels; Netflix, Twitch, and YouTube infrastructure; ThePrimeagen origin story; Learning programming languages; Best programming languages in 2025; Python; HTML & CSS; Bash; FFmpeg; Performance; Rust; Epic projects; Asserts; ADHD; Productivity; Programming setup; Coffee; Programming with AI; Advice for young programmers; Reddit questions; God","Programming; AI; ADHD; Productivity; Addiction; and God; Love for programming; Hardest part of programming; Types of programming; Life story; Hardship; High school; Porn addiction; God; Perseverance; Netflix; Groovy; Printf() debugging; Falcor; Breaking production; Pieter Levels; Netflix, Twitch, and YouTube infrastructure; ThePrimeagen origin story; Learning programming languages; Best programming languages in 2025; Python; HTML & CSS; Bash; FFmpeg; Performance; Rust; Epic projects; Asserts; ADHD; Productivity; Programming setup; Coffee; Programming with AI; Advice for young programmers; Reddit questions; God"
462,Ezra Klein And Derek Thompson,"Politics, Trump, AOC, Elon & DOGE",Politics; Trump; AOC; Elon; DOGE,"Episode highlight; Left-wing vs right-wing politics; Political leaders on the left and the right; Internal political divisions; AOC; Political realignment; Supply-side progressivism; Wealth redistribution; Housing problem; Regulation and deregulation; DOGE, Elon, and Trump; Sam Harris; Future of America","Politics; Trump; AOC; Elon; DOGE; Episode highlight; Left-wing vs right-wing politics; Political leaders on the left and the right; Internal political divisions; AOC; Political realignment; Supply-side progressivism; Wealth redistribution; Housing problem; Regulation and deregulation; DOGE, Elon, and Trump; Sam Harris; Future of America"
463,Douglas Murray,"Putin, Zelenskyy, Trump, Israel, Netanyahu, Hamas & Gaza",Putin; Zelenskyy; Trump; Israel; Netanyahu; Hamas; Gaza,Episode highlight; War in Ukraine; Trump and Zelenskyy; Putin; Peace; Zelenskyy; Israel-Palestine; Hamas; Corruption; Gaza; Benjamin Netanyahu; Hate; Iran; Interview advice; War,Putin; Zelenskyy; Trump; Israel; Netanyahu; Hamas; Gaza; Episode highlight; War in Ukraine; Trump and Zelenskyy; Putin; Peace; Zelenskyy; Israel-Palestine; Hamas; Corruption; Gaza; Benjamin Netanyahu; Hate; Iran; Interview advice; War
464,Dave Smith,"Israel, Ukraine, Epstein, Mossad, Conspiracies & Antisemitism",Israel; Ukraine; Epstein; Mossad; Conspiracies; Antisemitism,Episode highlight; Libertarianism; Ron Paul; Military–industrial complex; War on Terror; China and Taiwan; Just war theory; Israel and Gaza; Douglas Murray; Hamas; Hitler and Stalin; Darryl Cooper; Antisemitism; World leaders; Jeffrey Epstein; Sam Harris; Ukraine and Russia; Joe Rogan; Conspiracy theories; Hope,Israel; Ukraine; Epstein; Mossad; Conspiracies; Antisemitism; Episode highlight; Libertarianism; Ron Paul; Military–industrial complex; War on Terror; China and Taiwan; Just war theory; Israel and Gaza; Douglas Murray; Hamas; Hitler and Stalin; Darryl Cooper; Antisemitism; World leaders; Jeffrey Epstein; Sam Harris; Ukraine and Russia; Joe Rogan; Conspiracy theories; Hope
465,Robert Rodriguez,"Sin City, Desperado, El Mariachi, Alita, and Filmmaking",Sin City; Desperado; El Mariachi; Alita; and Filmmaking,Episode highlight; Explosions and having only one take; Success and failure; Filmmaking on a low budget; El Mariachi; Creativity; Limitations; Handling criticism; Action films; Quentin Tarantino; Desperado; Salma Hayek; Danny Trejo; Filming in Austin; Editing; Sound design; Deadlines; Alita: Battle Angel; James Cameron; Sin City; Manifesting; Memories and journaling; Mortality,Sin City; Desperado; El Mariachi; Alita; and Filmmaking; Episode highlight; Explosions and having only one take; Success and failure; Filmmaking on a low budget; El Mariachi; Creativity; Limitations; Handling criticism; Action films; Quentin Tarantino; Desperado; Salma Hayek; Danny Trejo; Filming in Austin; Editing; Sound design; Deadlines; Alita: Battle Angel; James Cameron; Sin City; Manifesting; Memories and journaling; Mortality
466,Jeffrey Wasserstrom,"China, Xi Jinping, Trade War, Taiwan, Hong Kong, Mao",China; Xi Jinping; Trade War; Taiwan; Hong Kong; Mao,Xi Jinping and Mao Zedong; Confucius; Education; Tiananmen Square; Tank Man; Censorship; Xi Jinping; Donald Trump; Trade war; Taiwan; Protests in Hong Kong; Mao Zedong; Future of China,China; Xi Jinping; Trade War; Taiwan; Hong Kong; Mao; Xi Jinping and Mao Zedong; Confucius; Education; Tiananmen Square; Tank Man; Censorship; Xi Jinping; Donald Trump; Trade war; Taiwan; Protests in Hong Kong; Mao Zedong; Future of China
467,Tim Sweeney,"Fortnite, Unreal Engine, and the Future of Gaming",Fortnite; Unreal Engine; and the Future of Gaming,"Episode highlight; 10,000 hours programming; Advice for young programmers; Video games in the 80s and 90s; Epic Games origin story; Indie game development; Unreal Engine; Technical details of Unreal Engine; Constructive solid geometry; Dynamic lighting; Volumetric fog; John Carmack; Evolution of Unreal Engine; Unreal Engine 5; Creating realistic humans; Lumen global illumination; Movies; Simulating reality; Metaverse; Fortnite; Scaling; Game economies; Standardizing the Metaverse; Verse programming language; Concurrency; Unreal Engine 6; Indie game developers; Apple; Epic Games Store; Future of gaming; Greatest games ever made; GTA 6 and Rockstar Games; Hope for the future","Fortnite; Unreal Engine; and the Future of Gaming; Episode highlight; 10,000 hours programming; Advice for young programmers; Video games in the 80s and 90s; Epic Games origin story; Indie game development; Unreal Engine; Technical details of Unreal Engine; Constructive solid geometry; Dynamic lighting; Volumetric fog; John Carmack; Evolution of Unreal Engine; Unreal Engine 5; Creating realistic humans; Lumen global illumination; Movies; Simulating reality; Metaverse; Fortnite; Scaling; Game economies; Standardizing the Metaverse; Verse programming language; Concurrency; Unreal Engine 6; Indie game developers; Apple; Epic Games Store; Future of gaming; Greatest games ever made; GTA 6 and Rockstar Games; Hope for the future"
468,Janna Levin,"Black Holes, Wormholes, Aliens, Paradoxes & Extra Dimensions",Black Holes; Wormholes; Aliens; Paradoxes; Extra Dimensions,"Episode highlight; Black holes; Formation of black holes; Oppenheimer and the Atomic Bomb; Inside the black hole; Supermassive black holes; Physics of spacetime; General relativity; Gravity; Information paradox; Fuzzballs & soft hair; ER = EPR; Firewall; Extra dimensions; Aliens; Wormholes; Dark matter and dark energy; Gravitational waves; Alan Turing and Kurt Godel; Grigori Perelman, Andrew Wiles, and Terence Tao; Art and science; The biggest mystery","Black Holes; Wormholes; Aliens; Paradoxes; Extra Dimensions; Episode highlight; Black holes; Formation of black holes; Oppenheimer and the Atomic Bomb; Inside the black hole; Supermassive black holes; Physics of spacetime; General relativity; Gravity; Information paradox; Fuzzballs & soft hair; ER = EPR; Firewall; Extra dimensions; Aliens; Wormholes; Dark matter and dark energy; Gravitational waves; Alan Turing and Kurt Godel; Grigori Perelman, Andrew Wiles, and Terence Tao; Art and science; The biggest mystery"
469,Oliver Anthony,"Country Music, Blue-Collar America, Fame, Money, and Pain",Country Music; Blue-Collar America; Fame; Money; and Pain,"Open mics; Mainstream country music; Fame; Music vs politics; Rich Men North of Richmond; Popularity, money, and integrity; Blue-collar people; Depression; Nature; Three-legged cat; I Want to Go Home (live performance); Guitar backstory; Playing live this year","Country Music; Blue-Collar America; Fame; Money; and Pain; Open mics; Mainstream country music; Fame; Music vs politics; Rich Men North of Richmond; Popularity, money, and integrity; Blue-collar people; Depression; Nature; Three-legged cat; I Want to Go Home (live performance); Guitar backstory; Playing live this year"
470,James Holland,"World War II, Hitler, Churchill, Stalin & Biggest Battles",World War II; Hitler; Churchill; Stalin; Biggest Battles,Episode highlight; World War II; Lebensraum and Hitler ideology; Operation Barbarossa; Hitler vs Europe; Joseph Goebbels; Hitler before WW2; Hitler vs Chamberlain; Invasion of Poland; Molotov–Ribbentrop Pact; Winston Churchill; Most powerful military in WW2; Tanks; Battle of Stalingrad; Concentration camps; Battle of Normandy; Lessons from WW2,World War II; Hitler; Churchill; Stalin; Biggest Battles; Episode highlight; World War II; Lebensraum and Hitler ideology; Operation Barbarossa; Hitler vs Europe; Joseph Goebbels; Hitler before WW2; Hitler vs Chamberlain; Invasion of Poland; Molotov–Ribbentrop Pact; Winston Churchill; Most powerful military in WW2; Tanks; Battle of Stalingrad; Concentration camps; Battle of Normandy; Lessons from WW2
471,Sundar Pichai,CEO of Google and Alphabet,CEO of Google; Alphabet,Episode highlight; Growing up in India; Advice for young people; Styles of leadership; Impact of AI in human history; Veo 3 and future of video; Scaling laws; AGI and ASI; P(doom); Toughest leadership decisions; AI mode vs Google Search; Google Chrome; Programming; Android; Questions for AGI; Future of humanity; Demo: Google Beam; Demo: Google XR Glasses; Biggest invention in human history,CEO of Google; Alphabet; Episode highlight; Growing up in India; Advice for young people; Styles of leadership; Impact of AI in human history; Veo 3 and future of video; Scaling laws; AGI and ASI; P(doom); Toughest leadership decisions; AI mode vs Google Search; Google Chrome; Programming; Android; Questions for AGI; Future of humanity; Demo: Google Beam; Demo: Google XR Glasses; Biggest invention in human history
472,Terence Tao,"Hardest Problems in Mathematics, Physics & the Future of AI",Hardest Problems in Mathematics; Physics; the Future of AI,First hard problem; Navier–Stokes singularity; Game of life; Infinity; Math vs Physics; Nature of reality; Theory of everything; General relativity; Solving difficult problems; AI-assisted theorem proving; Lean programming language; DeepMind’s AlphaProof; Human mathematicians vs AI; AI winning the Fields Medal; Grigori Perelman; Twin Prime Conjecture; Collatz conjecture; P = NP; Fields Medal; Andrew Wiles and Fermat’s Last Theorem; Productivity; Advice for young people; The greatest mathematician of all time,Hardest Problems in Mathematics; Physics; the Future of AI; First hard problem; Navier–Stokes singularity; Game of life; Infinity; Math vs Physics; Nature of reality; Theory of everything; General relativity; Solving difficult problems; AI-assisted theorem proving; Lean programming language; DeepMind’s AlphaProof; Human mathematicians vs AI; AI winning the Fields Medal; Grigori Perelman; Twin Prime Conjecture; Collatz conjecture; P = NP; Fields Medal; Andrew Wiles and Fermat’s Last Theorem; Productivity; Advice for young people; The greatest mathematician of all time
473,Iran War Debate,"Nuclear Weapons, Trump, Peace, Power & the Middle East",Nuclear Weapons; Trump; Peace; Power; the Middle East,Episode highlight; Iran-Israel War; Iran’s Nuclear Program; Nuclear weapons and uranium; Nuclear deal; Iran Nuclear Archive; Best case and worst case near-term future; US attack on Iran; Nuclear proliferation in the future; Libertarianism; Foundation for Defense of Democracies (FDD); Trump and Peacemaking process; WW2; WW3,Nuclear Weapons; Trump; Peace; Power; the Middle East; Episode highlight; Iran-Israel War; Iran’s Nuclear Program; Nuclear weapons and uranium; Nuclear deal; Iran Nuclear Archive; Best case and worst case near-term future; US attack on Iran; Nuclear proliferation in the future; Libertarianism; Foundation for Defense of Democracies (FDD); Trump and Peacemaking process; WW2; WW3
474,Dhh David Heinemeier Hansson,"DHH Future of Programming, AI, Ruby on Rails, Productivity & Parenting",DHH Future of Programming; AI; Ruby on Rails; Productivity; Parenting,Episode highlight; Programming; JavaScript; Google Chrome and DOJ; Ruby programming language; Beautiful code; Metaprogramming; Dynamic typing; Scaling; Future of programming; Future of AI; Vibe coding; Rails manifesto: Principles of a great programming language; Why managers are useless; Small teams; Jeff Bezos; Why meetings are toxic; Case against retirement; Hard work; Why we left the cloud; AWS; Owning your own servers; Elon Musk; Apple; Tim Sweeney; Fatherhood; Racing; Cars; Programming setup; Programming language for beginners; Open source; WordPress drama; Money and happiness; Hope,DHH Future of Programming; AI; Ruby on Rails; Productivity; Parenting; Episode highlight; Programming; JavaScript; Google Chrome and DOJ; Ruby programming language; Beautiful code; Metaprogramming; Dynamic typing; Scaling; Future of programming; Future of AI; Vibe coding; Rails manifesto: Principles of a great programming language; Why managers are useless; Small teams; Jeff Bezos; Why meetings are toxic; Case against retirement; Hard work; Why we left the cloud; AWS; Owning your own servers; Elon Musk; Apple; Tim Sweeney; Fatherhood; Racing; Cars; Programming setup; Programming language for beginners; Open source; WordPress drama; Money and happiness; Hope
475,Demis Hassabis,"Future of AI, Simulating Reality, Physics and Video Games",Future of AI; Simulating Reality; Physics; Video Games,Episode highlight; Learnable patterns in nature; Computation and P vs NP; Veo 3 and understanding reality; Video games; AlphaEvolve; AI research; Simulating a biological organism; Origin of life; Path to AGI; Scaling laws; Compute; Future of energy; Human nature; Google and the race to AGI; Competition and AI talent; Future of programming; John von Neumann; p(doom); Humanity; Consciousness and quantum computation; David Foster Wallace; Education and research,Future of AI; Simulating Reality; Physics; Video Games; Episode highlight; Learnable patterns in nature; Computation and P vs NP; Veo 3 and understanding reality; Video games; AlphaEvolve; AI research; Simulating a biological organism; Origin of life; Path to AGI; Scaling laws; Compute; Future of energy; Human nature; Google and the race to AGI; Competition and AI talent; Future of programming; John von Neumann; p(doom); Humanity; Consciousness and quantum computation; David Foster Wallace; Education and research
476,Jack Weatherford,Genghis Khan and the Mongol Empire,Genghis Khan; the Mongol Empire,Origin story of Genghis Khan; Early battles & conquests; Power; Secret History; Mongolian steppe; Mounted archery and horse-riding; Genghis Khan’s army; Military tactics and strategy; Wars of conquest; Dan Carlin; Religious freedom; Trade and the Silk Road; Weapons innovation; Kublai Khan and conquering China; Fall of the Mongol Empire; Genetic legacy; Lessons from Genghis Khan; Human nature; Visiting Mongolia; Lex: Dan Carlin; Lex: Gaza,Genghis Khan; the Mongol Empire; Origin story of Genghis Khan; Early battles & conquests; Power; Secret History; Mongolian steppe; Mounted archery and horse-riding; Genghis Khan’s army; Military tactics and strategy; Wars of conquest; Dan Carlin; Religious freedom; Trade and the Silk Road; Weapons innovation; Kublai Khan and conquering China; Fall of the Mongol Empire; Genetic legacy; Lessons from Genghis Khan; Human nature; Visiting Mongolia; Lex: Dan Carlin; Lex: Gaza
