episode_number,guest,title,title_topics,chapter_topics,all_topics
477,Keyu Jin,"China's Economy, Tariffs, Trade, Trump, Communism & Capitalism",China's Economy; Tariffs; Trade; Trump; Communism; Capitalism,Misconceptions about China; Education in China; Economic reforms of Deng Xiaoping; Mayor economy and GDP growth race; Growing up in China; First time in the US; China’s government vs business sector; Communism and capitalism; Jack Ma; China’s view on innovation and copying ideas; DeepSeek moment; CHIPS Act; Tariffs and Trade; Immigration; Taiwan; One-child policy; China’s economy collapse predictions; Advice for visiting China,China's Economy; Tariffs; Trade; Trump; Communism; Capitalism; Misconceptions about China; Education in China; Economic reforms of Deng Xiaoping; Mayor economy and GDP growth race; Growing up in China; First time in the US; China’s government vs business sector; Communism and capitalism; Jack Ma; China’s view on innovation and copying ideas; DeepSeek moment; CHIPS Act; Tariffs and Trade; Immigration; Taiwan; One-child policy; China’s economy collapse predictions; Advice for visiting China
479,Dave Plummer,"Programming, Autism, and Old-School Microsoft Stories",Programming; Autism; and Old-School Microsoft Stories,First computer; Dropping out of high-school; Joining Microsoft; MS-DOS; Windows 95; The man behind Windows; Debugging; Task Manager; 3D Pinball: Space Cadet; Start menu and taskbar; Blue Screen of Death; Best programmers; Scariest time of Dave’s life; Best Windows version; Slot machines; Autism and ADHD; Fastest programming language; Future of programming,Programming; Autism; and Old-School Microsoft Stories; First computer; Dropping out of high-school; Joining Microsoft; MS-DOS; Windows 95; The man behind Windows; Debugging; Task Manager; 3D Pinball: Space Cadet; Start menu and taskbar; Blue Screen of Death; Best programmers; Scariest time of Dave’s life; Best Windows version; Slot machines; Autism and ADHD; Fastest programming language; Future of programming
480,Dave Hone,"T-Rex, Dinosaurs, Extinction, Evolution, and Jurassic Park",T-Rex; Dinosaurs; Extinction; Evolution; and Jurassic Park,Episode highlight; T-Rex’s size & biomechanics; T-Rex’s hunting strategies; History of dinosaurs on Earth; $31.8 million T-Rex fossil; T-Rex’s skull and bone-crushing bite force; What Jurassic Park got wrong; Evolution and sexual selection; Spinosaurus; What Jurassic Park got right; T-Rex’s intelligence; Cannibalism among T-Rex; Extinction of the dinosaurs; Dragons; Birds are dinosaurs; Future of paleontology,T-Rex; Dinosaurs; Extinction; Evolution; and Jurassic Park; Episode highlight; T-Rex’s size & biomechanics; T-Rex’s hunting strategies; History of dinosaurs on Earth; $31.8 million T-Rex fossil; T-Rex’s skull and bone-crushing bite force; What Jurassic Park got wrong; Evolution and sexual selection; Spinosaurus; What Jurassic Park got right; T-Rex’s intelligence; Cannibalism among T-Rex; Extinction of the dinosaurs; Dragons; Birds are dinosaurs; Future of paleontology
481,Norman Ohler,"Hitler, Nazis, Drugs, WW2, Blitzkrieg, LSD, MKUltra & CIA",Hitler; Nazis; Drugs; WW2; Blitzkrieg; LSD; MKUltra; CIA,"Episode highlight; Drugs in post-WWI Germany; Nazi rise to power; Hitler’s drug use; Response to historian criticism; Pervitin; Blitzkrieg and meth; Erwin Rommel (Crystal Fox); Dunkirk; Hitler’s drug addiction; Methamphetamine; Invasion of Soviet Union; Cocaine; Hitler’s last days; German resistance against Nazis; Totalitarianism; Stoned Sapiens; Religion; LSD, CIA, and MKUltra; Writing on drugs; Berlin night clubs; Greatest book ever written","Hitler; Nazis; Drugs; WW2; Blitzkrieg; LSD; MKUltra; CIA; Episode highlight; Drugs in post-WWI Germany; Nazi rise to power; Hitler’s drug use; Response to historian criticism; Pervitin; Blitzkrieg and meth; Erwin Rommel (Crystal Fox); Dunkirk; Hitler’s drug addiction; Methamphetamine; Invasion of Soviet Union; Cocaine; Hitler’s last days; German resistance against Nazis; Totalitarianism; Stoned Sapiens; Religion; LSD, CIA, and MKUltra; Writing on drugs; Berlin night clubs; Greatest book ever written"
482,Pavel Durov,"Telegram, Freedom, Censorship, Money, Power & Human Nature",Telegram; Freedom; Censorship; Money; Power; Human Nature,"Philosophy of freedom; No alcohol; No phone; Discipline; Telegram: Lean philosophy, privacy, and geopolitics; Arrest in France; Romanian elections; Power and corruption; Intense education; Nikolai Durov; Programming and video games; VK origins & engineering; Hiring a great team; Telegram engineering & design; Encryption; Open source; Edward Snowden; Intelligence agencies; Iran and Russia government pressure; Apple; Poisoning; Money; TON; Bitcoin; Two chairs dilemma; Children; Father; Quantum immortality; Kafka","Telegram; Freedom; Censorship; Money; Power; Human Nature; Philosophy of freedom; No alcohol; No phone; Discipline; Telegram: Lean philosophy, privacy, and geopolitics; Arrest in France; Romanian elections; Power and corruption; Intense education; Nikolai Durov; Programming and video games; VK origins & engineering; Hiring a great team; Telegram engineering & design; Encryption; Open source; Edward Snowden; Intelligence agencies; Iran and Russia government pressure; Apple; Poisoning; Money; TON; Bitcoin; Two chairs dilemma; Children; Father; Quantum immortality; Kafka"
483,Julia Shaw,"Criminal Psychology of Murder, Serial Killers, Memory & Sex",Criminal Psychology of Murder; Serial Killers; Memory; Sex,Episode highlight; Dark Tetrad; Serial killers; Murder; Lies and scams; Jealousy; Monogamy; Sexuality; Sexual fetishes; Criminal psychology; False memories; Criminals destroying the planet; Hope,Criminal Psychology of Murder; Serial Killers; Memory; Sex; Episode highlight; Dark Tetrad; Serial killers; Murder; Lies and scams; Jealousy; Monogamy; Sexuality; Sexual fetishes; Criminal psychology; False memories; Criminals destroying the planet; Hope
484,Dan Houser,"GTA, Red Dead Redemption, Rockstar, Absurd & Future of Gaming",GTA; Red Dead Redemption; Rockstar; Absurd; Future of Gaming,Episode highlight; Greatest films of all time; Making video games; GTA 3; Open world video games; Character creation; Superintelligent AI in A Better Paradise; Can LLMs write video games?; Creating GTA 4 and GTA 5; Hard work and Rockstar’s culture of excellence; GTA 6; Red Dead Redemption 2; DLCs for GTA and Red Dead Redemption; Leaving Rockstar Games; Greatest game of all time; Life lessons from father; Mortality; Advice for young people; Future of video games,GTA; Red Dead Redemption; Rockstar; Absurd; Future of Gaming; Episode highlight; Greatest films of all time; Making video games; GTA 3; Open world video games; Character creation; Superintelligent AI in A Better Paradise; Can LLMs write video games?; Creating GTA 4 and GTA 5; Hard work and Rockstar’s culture of excellence; GTA 6; Red Dead Redemption 2; DLCs for GTA and Red Dead Redemption; Leaving Rockstar Games; Greatest game of all time; Life lessons from father; Mortality; Advice for young people; Future of video games
485,David Kirtley,"Nuclear Fusion, Plasma Physics, and the Future of Energy",Nuclear Fusion; Plasma Physics; and the Future of Energy,Nuclear fission vs fusion; Physics of E=mc^2; Is nuclear fusion safe?; Chernobyl; Geopolitics; Extreme scenarios; How nuclear fusion works; Extreme temperatures; Fusion control and simulation; Electricity from fusion; First fusion power plant in 2028; Energy needs of GPU clusters; Kardashev scale; Fermi Paradox,Nuclear Fusion; Plasma Physics; and the Future of Energy; Nuclear fission vs fusion; Physics of E=mc^2; Is nuclear fusion safe?; Chernobyl; Geopolitics; Extreme scenarios; How nuclear fusion works; Extreme temperatures; Fusion control and simulation; Electricity from fusion; First fusion power plant in 2028; Energy needs of GPU clusters; Kardashev scale; Fermi Paradox
486,Michael Levin,Hidden Reality of Alien Intelligence & Biological Life,Hidden Reality of Alien Intelligence; Biological Life,Biological intelligence; Living vs non-living organisms; Origin of life; The search for alien life (on Earth); Creating life in the lab; Memories and ideas are living organisms; Reality is an illusion: The brain is an interface to a hidden reality; Unexpected intelligence of sorting algorithms; Can aging be reversed?; Mind uploading; Alien intelligence; Advice for young people; Questions for AGI,Hidden Reality of Alien Intelligence; Biological Life; Biological intelligence; Living vs non-living organisms; Origin of life; The search for alien life (on Earth); Creating life in the lab; Memories and ideas are living organisms; Reality is an illusion: The brain is an interface to a hidden reality; Unexpected intelligence of sorting algorithms; Can aging be reversed?; Mind uploading; Alien intelligence; Advice for young people; Questions for AGI
487,Irving Finkel,Deciphering Secrets of Ancient Civilizations & Flood Myths,Deciphering Secrets of Ancient Civilizations; Flood Myths,Origins of human language; Cuneiform; Controversial theory about Göbekli Tepe; How to write and speak Cuneiform; Primitive human language; Development of writing systems; Decipherment of Cuneiform; Limits of language; Art of translation; Gods; Ghosts; Ancient flood stories; Noah’s Ark; The Royal Game of Ur; British Museum; Evolution of human civilization,Deciphering Secrets of Ancient Civilizations; Flood Myths; Origins of human language; Cuneiform; Controversial theory about Göbekli Tepe; How to write and speak Cuneiform; Primitive human language; Development of writing systems; Decipherment of Cuneiform; Limits of language; Art of translation; Gods; Ghosts; Ancient flood stories; Noah’s Ark; The Royal Game of Ur; British Museum; Evolution of human civilization
488,Joel David Hamkins,"Infinity, Paradoxes that Broke Mathematics, Gödel Incompleteness & the Multiverse",Infinity; Paradoxes that Broke Mathematics; Gödel Incompleteness; the Multiverse,Infinity & paradoxes; Russell’s paradox; Gödel’s incompleteness theorems; Truth vs proof; The Halting Problem; Does infinity exist?; MathOverflow; The Continuum Hypothesis; Hardest problems in mathematics; Mathematical multiverse; Surreal numbers; Conway’s Game of Life; Computability theory; P vs NP; Greatest mathematicians in history; Infinite chess; Most beautiful idea in mathematics,Infinity; Paradoxes that Broke Mathematics; Gödel Incompleteness; the Multiverse; Infinity & paradoxes; Russell’s paradox; Gödel’s incompleteness theorems; Truth vs proof; The Halting Problem; Does infinity exist?; MathOverflow; The Continuum Hypothesis; Hardest problems in mathematics; Mathematical multiverse; Surreal numbers; Conway’s Game of Life; Computability theory; P vs NP; Greatest mathematicians in history; Infinite chess; Most beautiful idea in mathematics
489,Paul Rosolie,Uncontacted Tribes in the Amazon Jungle,Uncontacted Tribes in the Amazon Jungle,"Episode highlight; Uncontacted tribes in the Amazon Jungle; Intense new encounter; Never-before-seen footage of tribe warriors; The mysteries of the jungle; Tribe’s diet: Monkeys, turtles, and turtle eggs; Jane Goodall; Advice for young people; Cartel, Narco-traffickers & assassination attempts; Climbing the giant tree; Giant anaconda; Rescuing a spider monkey; Dangerous animal encounters; Writing, journaling, and great writer inspirations","Uncontacted Tribes in the Amazon Jungle; Episode highlight; Uncontacted tribes in the Amazon Jungle; Intense new encounter; Never-before-seen footage of tribe warriors; The mysteries of the jungle; Tribe’s diet: Monkeys, turtles, and turtle eggs; Jane Goodall; Advice for young people; Cartel, Narco-traffickers & assassination attempts; Climbing the giant tree; Giant anaconda; Rescuing a spider monkey; Dangerous animal encounters; Writing, journaling, and great writer inspirations"
